[INFO] Scanning for projects...
[INFO] Tycho Version:  5.0.2 (9f65dc09a72ee08f29cc8a4d5381a45b33dc7144)
[INFO] Tycho Mode:     project
[INFO] Tycho Builder:  maven
[INFO] Build Threads:  1
Downloading from local: file:///home/runner/.m2/repository/org/sandbox/sandbox_target/1.2.6-SNAPSHOT/maven-metadata.xml
[INFO] 
[INFO] ---------------< org.sandbox:sandbox_jface_cleanup_test >---------------
[INFO] Building Sandbox jface cleanup test 1.2.6-SNAPSHOT
[INFO]   from pom.xml
[INFO] ------------------------[ eclipse-test-plugin ]-------------------------
[INFO] Resolving target definition file:/home/runner/.m2/repository/org/sandbox/sandbox_target/1.2.6-SNAPSHOT/sandbox_target-1.2.6-SNAPSHOT.target for environments=[win32/win32/x86_64, linux/gtk/x86_64, macosx/cocoa/x86_64], include source mode=honor, referenced repository mode =include, execution environment=StandardEEResolutionHints [executionEnvironment=OSGi profile 'JavaSE-21' { source level: 21, target level: 21}] with Tycho Provisioning Agent (extension>org.eclipse.tycho:tycho-maven-plugin:5.0.2)
[INFO] ### Using TychoRepositoryTransport for remote P2 access ###
[INFO]     Cache location:         /home/runner/.m2/repository/.cache/tycho
[INFO]     Transport mode:         online
[INFO]     Http Transport type:    Java11Client
[INFO]     Update mode:            cache first
[INFO]     Minimum cache duration: 60 minutes
[INFO]       (you can configure this with -Dtycho.p2.transport.min-cache-minutes=<desired minimum cache duration>)
[INFO] Downloading from p2: https://download.eclipse.org/releases/2025-12/p2.index
[INFO] Downloaded from p2: https://download.eclipse.org/releases/2025-12/p2.index (122 bytes at 0 bytes/s)
[INFO] Downloading from p2: https://download.eclipse.org/technology/epp/packages/2025-12/p2.index
[INFO] Downloading from p2: https://download.eclipse.org/technology/epp/packages/2025-12/202512041000/p2.index
[INFO] Downloaded from p2: https://download.eclipse.org/technology/epp/packages/2025-12/202512041000/p2.index (365 bytes at 356 KB/s)
[INFO] Downloading from p2: https://download.eclipse.org/releases/2025-12/202512101000/p2.index
[INFO] Downloaded from p2: https://download.eclipse.org/releases/2025-12/202512101000/p2.index (140 bytes at 136 KB/s)
[INFO] Downloading from p2: https://download.eclipse.org/tools/orbit/simrel/orbit-aggregation/2025-12/p2.index
[INFO] Downloaded from p2: https://download.eclipse.org/tools/orbit/simrel/orbit-aggregation/2025-12/p2.index (126 bytes at 123 KB/s)
[INFO] Downloading from p2: https://download.eclipse.org/tools/orbit/simrel/orbit-aggregation/release/4.38.0/p2.index
[INFO] Downloaded from p2: https://download.eclipse.org/tools/orbit/simrel/orbit-aggregation/release/4.38.0/p2.index (172 bytes at 167 KB/s)
[INFO] Downloading from p2: https://download.eclipse.org/cbi/updates/license/p2.index
[INFO] Downloaded from p2: https://download.eclipse.org/cbi/updates/license/p2.index (134 bytes at 130 KB/s)
[INFO] Downloading from p2: https://download.eclipse.org/cbi/updates/license/1.0.0.v20131003-1638/p2.index
[INFO] Downloading from p2: https://download.eclipse.org/cbi/updates/license/1.0.1.v20140414-1359/p2.index
[INFO] Downloading from p2: https://download.eclipse.org/cbi/updates/license/2.0.2.v20181016-2210/p2.index
[INFO] Downloaded from p2: https://download.eclipse.org/cbi/updates/license/2.0.2.v20181016-2210/p2.index (172 bytes at 167 KB/s)
[INFO] Downloading from p2: https://download.eclipse.org/egit/updates/p2.index
[INFO] Downloaded from p2: https://download.eclipse.org/egit/updates/p2.index (172 bytes at 167 KB/s)
[INFO] Downloading from p2: https://download.eclipse.org/tools/orbit/simrel/orbit-aggregation/release/4.36.0/p2.index
[INFO] Downloaded from p2: https://download.eclipse.org/tools/orbit/simrel/orbit-aggregation/release/4.36.0/p2.index (172 bytes at 167 KB/s)
[INFO] Downloading from p2: https://download.eclipse.org/tools/orbit/simrel/maven-osgi/release/4.37.0/p2.index
[INFO] Downloaded from p2: https://download.eclipse.org/tools/orbit/simrel/maven-osgi/release/4.37.0/p2.index (172 bytes at 167 KB/s)
[WARNING] p2 repository with URL https://download.eclipse.org/releases/2025-12 is associated with multiple IDs; was '', now is 'eclipse-2025-12'
[WARNING] p2 repository with URL https://download.eclipse.org/tools/orbit/simrel/orbit-aggregation/2025-12 is associated with multiple IDs; was '', now is 'orbit'
[WARNING] p2 repository with URL https://download.eclipse.org/cbi/updates/license is associated with multiple IDs; was '', now is 'cbi-license'
[WARNING] p2 repository with URL https://download.eclipse.org/egit/updates is associated with multiple IDs; was '', now is 'egit'
[INFO] Downloading from p2: https://download.eclipse.org/justj/jres/21/updates/release/latest/p2.index
[INFO] Downloaded from p2: https://download.eclipse.org/justj/jres/21/updates/release/latest/p2.index (126 bytes at 123 KB/s)
[INFO] Adding repository https://download.eclipse.org/justj/jres/21/updates/release/latest
[INFO] Downloading from p2: https://download.eclipse.org/justj/jres/21/updates/release/21.0.10/p2.index
[INFO] Downloaded from p2: https://download.eclipse.org/justj/jres/21/updates/release/21.0.10/p2.index (172 bytes at 167 KB/s)
[INFO] Downloading from p2: https://download.eclipse.org/technology/babel/update-site/latest/p2.index
[INFO] Adding repository https://download.eclipse.org/technology/babel/update-site/latest
[INFO] Maven Artifact org.codehaus.mojo:animal-sniffer-annotations:1.9 @ /home/runner/.m2/repository/org/codehaus/mojo/animal-sniffer-annotations/1.9/animal-sniffer-annotations-1.9.jar is not a bundle and will be ignored, automatic wrapping of such artifacts can be enabled with <pomDependencies>wrapAsBundle</pomDependencies> in target platform configuration.
[INFO] Downloading from p2: https://download.eclipse.org/releases/2025-12/p2.index
[INFO] Downloaded from p2: https://download.eclipse.org/releases/2025-12/p2.index (122 bytes at 119 KB/s)
[INFO] Downloading from p2: https://download.eclipse.org/technology/epp/packages/2025-12/p2.index
[INFO] Downloading from p2: https://download.eclipse.org/technology/epp/packages/2025-12/202512041000/p2.index
[INFO] Downloaded from p2: https://download.eclipse.org/technology/epp/packages/2025-12/202512041000/p2.index (365 bytes at 356 KB/s)
[INFO] Downloading from p2: https://download.eclipse.org/releases/2025-12/202512101000/p2.index
[INFO] Downloaded from p2: https://download.eclipse.org/releases/2025-12/202512101000/p2.index (140 bytes at 136 KB/s)
[INFO] Downloading from p2: https://download.eclipse.org/tools/orbit/simrel/orbit-aggregation/2025-12/p2.index
[INFO] Downloaded from p2: https://download.eclipse.org/tools/orbit/simrel/orbit-aggregation/2025-12/p2.index (126 bytes at 123 KB/s)
[INFO] Downloading from p2: https://download.eclipse.org/tools/orbit/simrel/orbit-aggregation/release/4.38.0/p2.index
[INFO] Downloaded from p2: https://download.eclipse.org/tools/orbit/simrel/orbit-aggregation/release/4.38.0/p2.index (172 bytes at 167 KB/s)
[INFO] Downloading from p2: https://download.eclipse.org/cbi/updates/license/p2.index
[INFO] Downloaded from p2: https://download.eclipse.org/cbi/updates/license/p2.index (134 bytes at 130 KB/s)
[INFO] Downloading from p2: https://download.eclipse.org/cbi/updates/license/1.0.0.v20131003-1638/p2.index
[INFO] Downloading from p2: https://download.eclipse.org/cbi/updates/license/1.0.1.v20140414-1359/p2.index
[INFO] Downloading from p2: https://download.eclipse.org/cbi/updates/license/2.0.2.v20181016-2210/p2.index
[INFO] Downloaded from p2: https://download.eclipse.org/cbi/updates/license/2.0.2.v20181016-2210/p2.index (172 bytes at 167 KB/s)
[INFO] Downloading from p2: https://download.eclipse.org/egit/updates/p2.index
[INFO] Downloaded from p2: https://download.eclipse.org/egit/updates/p2.index (172 bytes at 167 KB/s)
[INFO] Downloading from p2: https://download.eclipse.org/tools/orbit/simrel/orbit-aggregation/release/4.36.0/p2.index
[INFO] Downloaded from p2: https://download.eclipse.org/tools/orbit/simrel/orbit-aggregation/release/4.36.0/p2.index (172 bytes at 167 KB/s)
[INFO] Downloading from p2: https://download.eclipse.org/justj/jres/21/updates/release/latest/p2.index
[INFO] Downloaded from p2: https://download.eclipse.org/justj/jres/21/updates/release/latest/p2.index (126 bytes at 123 KB/s)
[INFO] Downloading from p2: https://download.eclipse.org/justj/jres/21/updates/release/21.0.10/p2.index
[INFO] Downloaded from p2: https://download.eclipse.org/justj/jres/21/updates/release/21.0.10/p2.index (172 bytes at 167 KB/s)
[INFO] Downloading from p2: https://download.eclipse.org/technology/babel/update-site/latest/p2.index
[INFO] Downloading from p2: https://download.eclipse.org/tools/orbit/simrel/maven-osgi/release/4.37.0/p2.index
[INFO] Downloaded from p2: https://download.eclipse.org/tools/orbit/simrel/maven-osgi/release/4.37.0/p2.index (172 bytes at 167 KB/s)
[WARNING] The following locally built units have been used to resolve project dependencies:
[WARNING]   sandbox_test_commons/1.2.6.202602120329
[WARNING]   sandbox_jface_cleanup/1.2.6.202602120339
[WARNING]   sandbox_common/1.2.6.202602120323
[INFO] 
[INFO] --- clean:3.2.0:clean (default-clean) @ sandbox_jface_cleanup_test ---
[INFO] Deleting /home/runner/work/sandbox/sandbox/sandbox_jface_cleanup_test/target
[INFO] 
[INFO] --- tycho-packaging:5.0.2:build-qualifier (default-build-qualifier) @ sandbox_jface_cleanup_test ---
[INFO] The project's OSGi version is 1.2.6.202602120342
[INFO] 
[INFO] --- tycho-packaging:5.0.2:validate-id (default-validate-id) @ sandbox_jface_cleanup_test ---
[INFO] 
[INFO] --- tycho-packaging:5.0.2:validate-version (default-validate-version) @ sandbox_jface_cleanup_test ---
[INFO] 
[INFO] --- enforcer:3.6.2:enforce (enforce-java-version) @ sandbox_jface_cleanup_test ---
[INFO] Rule 0: org.apache.maven.enforcer.rules.version.RequireJavaVersion passed
[INFO] 
[INFO] --- target-platform-configuration:5.0.2:target-platform (default-target-platform) @ sandbox_jface_cleanup_test ---
[INFO] 
[INFO] --- tycho-compiler:5.0.2:validate-classpath (default-validate-classpath) @ sandbox_jface_cleanup_test ---
[INFO] Resolving class path of Sandbox jface cleanup test
[WARNING] Plugin is modifying testCompileSourceRoots through iterator.remove(), which will not work in Maven 4.0.0. Use MavenProject.addTestCompileSourceRoot()/removeTestCompileSourceRoot() methods instead. If using a plugin, please upgrade to the latest version or report the issue to the plugin maintainer. To disable these warnings, set -Dmaven.project.sourceRoots.warningsDisabled=true on the command line, in the .mvn/maven.config file, or in project POM properties.
[INFO] 
[INFO] --- resources:3.3.1:resources (default-resources) @ sandbox_jface_cleanup_test ---
[INFO] skip non existing resourceDirectory /home/runner/work/sandbox/sandbox/sandbox_jface_cleanup_test/src/main/resources
[INFO] 
[INFO] --- tycho-compiler:5.0.2:compile (default-compile) @ sandbox_jface_cleanup_test ---
[INFO] Compiling 1 source file to /home/runner/work/sandbox/sandbox/sandbox_jface_cleanup_test/target/classes using Eclipse Compiler for Java(TM) 3.44.0.v20251118-1623
[INFO] 
[INFO] >>> spotbugs:4.9.8.2:check (analyze-compile) > :spotbugs @ sandbox_jface_cleanup_test >>>
[INFO] 
[INFO] --- spotbugs:4.9.8.2:spotbugs (spotbugs) @ sandbox_jface_cleanup_test ---
[INFO] Fork Value is true
[INFO] Done SpotBugs Analysis....
[INFO] Skipping com.github.spotbugs:spotbugs-maven-plugin:4.9.8.2:spotbugs report goal
[INFO] 
[INFO] <<< spotbugs:4.9.8.2:check (analyze-compile) < :spotbugs @ sandbox_jface_cleanup_test <<<
[INFO] 
[INFO] 
[INFO] --- spotbugs:4.9.8.2:check (analyze-compile) @ sandbox_jface_cleanup_test ---
[INFO] BugInstance size is 0
[INFO] Error size is 0
[INFO] No errors/warnings found
[INFO] 
[INFO] --- tycho-ds:5.0.2:declarative-services (default-declarative-services) @ sandbox_jface_cleanup_test ---
[INFO] 
[INFO] --- resources:3.3.1:testResources (default-testResources) @ sandbox_jface_cleanup_test ---
[INFO] skip non existing resourceDirectory /home/runner/work/sandbox/sandbox/sandbox_jface_cleanup_test/src/test/resources
[INFO] 
[INFO] --- tycho-packaging:5.0.2:update-consumer-pom (default-update-consumer-pom) @ sandbox_jface_cleanup_test ---
[INFO] 163 system scoped dependencies were not mapped to maven artifacts
[INFO] 
[INFO] --- tycho-packaging:5.0.2:package-plugin (default-package-plugin) @ sandbox_jface_cleanup_test ---
[INFO] Building jar: /home/runner/work/sandbox/sandbox/sandbox_jface_cleanup_test/target/sandbox_jface_cleanup_test-1.2.6-SNAPSHOT.jar
[INFO] 
[INFO] --- tycho-p2-plugin:5.0.2:p2-metadata-default (default-p2-metadata-default) @ sandbox_jface_cleanup_test ---
[INFO] 
[INFO] --- tycho-surefire:5.0.2:test (default-test) @ sandbox_jface_cleanup_test ---
[INFO] Selected test framework junit (5.0.0) with provider junit5vintage [5.12.0,6.0.0)
[INFO] Executing test runtime with timeout (seconds): 0, logs, if any, will be placed at: /home/runner/work/sandbox/sandbox/sandbox_jface_cleanup_test/target/work/data/.metadata/.log
[INFO] Command line: /usr/lib/jvm/temurin-21-jdk-amd64/bin/java -Dosgi.noShutdown=false -Dosgi.os=linux -Dosgi.ws=gtk -Dosgi.arch=x86_64 -Dosgi.clean=true -jar /home/runner/.m2/repository/p2/osgi/bundle/org.eclipse.equinox.launcher/1.7.100.v20251111-0406/org.eclipse.equinox.launcher-1.7.100.v20251111-0406.jar -data /home/runner/work/sandbox/sandbox/sandbox_jface_cleanup_test/target/work/data -install /home/runner/work/sandbox/sandbox/sandbox_jface_cleanup_test/target/work -configuration /home/runner/work/sandbox/sandbox/sandbox_jface_cleanup_test/target/work/configuration -application org.eclipse.tycho.surefire.osgibooter.uitest -testproperties /home/runner/work/sandbox/sandbox/sandbox_jface_cleanup_test/target/surefire.properties
SWT SessionManagerDBus: Failed to connect to org.gnome.SessionManager: Could not connect: Permission denied
SWT SessionManagerDBus: Failed to connect to org.xfce.SessionManager: Could not connect: Permission denied
Running org.sandbox.jdt.ui.tests.quickfix.Java8CleanUpTest
JFacePlugin DEBUG: Found beginTask at position 403 (type: MethodInvocation)
JFacePlugin DEBUG: Found SubProgressMonitor construction at position 519 for variable 'monitor' with beginTask
JFacePlugin DEBUG: Found SubProgressMonitor construction at position 595 for variable 'monitor' with beginTask
JFacePlugin: Adding 1 dataholder operations
JFacePlugin DEBUG: Rewriting beginTask at position 403 (method: beginTask)
JFacePlugin DEBUG: Created SubMonitor.convert call: SubMonitor.convert(MISSING,MISSING.MISSING,0)
JFacePlugin DEBUG: Rewriting SubProgressMonitor at position 595 (ClassInstanceCreation)
JFacePlugin DEBUG: Rewriting SubProgressMonitor at position 519 (ClassInstanceCreation)
JFacePlugin DEBUG: Found beginTask at position 403 (type: MethodInvocation)
JFacePlugin DEBUG: Found SubProgressMonitor construction at position 519 for variable 'monitor' with beginTask
JFacePlugin DEBUG: Found SubProgressMonitor construction at position 595 for variable 'monitor' with beginTask
JFacePlugin DEBUG: Found beginTask at position 747 (type: MethodInvocation)
JFacePlugin DEBUG: Found SubProgressMonitor construction at position 864 for variable 'monitor' with beginTask
JFacePlugin DEBUG: Found SubProgressMonitor construction at position 940 for variable 'monitor' with beginTask
JFacePlugin: Adding 2 dataholder operations
JFacePlugin DEBUG: Rewriting beginTask at position 403 (method: beginTask)
JFacePlugin DEBUG: Created SubMonitor.convert call: SubMonitor.convert(MISSING,MISSING.MISSING,0)
JFacePlugin DEBUG: Rewriting SubProgressMonitor at position 595 (ClassInstanceCreation)
JFacePlugin DEBUG: Rewriting SubProgressMonitor at position 519 (ClassInstanceCreation)
JFacePlugin DEBUG: Rewriting beginTask at position 747 (method: beginTask)
JFacePlugin DEBUG: Created SubMonitor.convert call: SubMonitor.convert(MISSING,MISSING.MISSING,0)
JFacePlugin DEBUG: Rewriting SubProgressMonitor at position 940 (ClassInstanceCreation)
JFacePlugin DEBUG: Rewriting SubProgressMonitor at position 864 (ClassInstanceCreation)
JFacePlugin DEBUG: Found beginTask at position 186 (type: MethodInvocation)
JFacePlugin DEBUG: Found SubProgressMonitor construction at position 242 for variable 'monitor' with beginTask
JFacePlugin: Adding 1 dataholder operations
JFacePlugin DEBUG: Rewriting beginTask at position 186 (method: beginTask)
JFacePlugin DEBUG: Created SubMonitor.convert call: SubMonitor.convert(MISSING,"",0)
JFacePlugin DEBUG: Rewriting SubProgressMonitor at position 242 (ClassInstanceCreation)
JFacePlugin DEBUG: Found beginTask at position 216 (type: MethodInvocation)
JFacePlugin DEBUG: Found SubProgressMonitor construction at position 272 for variable 'monitor' with beginTask
JFacePlugin: Adding 1 dataholder operations
JFacePlugin DEBUG: Rewriting beginTask at position 216 (method: beginTask)
JFacePlugin DEBUG: Created SubMonitor.convert call: SubMonitor.convert(MISSING,"",0)
JFacePlugin DEBUG: Rewriting SubProgressMonitor at position 272 (ClassInstanceCreation)
JFacePlugin DEBUG: Found beginTask at position 560 (type: MethodInvocation)
JFacePlugin DEBUG: Found SubProgressMonitor construction at position 628 for variable 'monitor' with beginTask
JFacePlugin: Adding 1 dataholder operations
JFacePlugin DEBUG: Rewriting beginTask at position 560 (method: beginTask)
JFacePlugin DEBUG: Created SubMonitor.convert call: SubMonitor.convert(MISSING,"",0)
JFacePlugin DEBUG: Rewriting SubProgressMonitor at position 628 (ClassInstanceCreation)
JFacePlugin DEBUG: Found beginTask at position 191 (type: MethodInvocation)
JFacePlugin DEBUG: Found SubProgressMonitor construction at position 252 for variable 'monitor' with beginTask
JFacePlugin DEBUG: Found beginTask at position 369 (type: MethodInvocation)
JFacePlugin DEBUG: Found SubProgressMonitor construction at position 432 for variable 'monitor' with beginTask
JFacePlugin: Adding 2 dataholder operations
JFacePlugin DEBUG: Rewriting beginTask at position 191 (method: beginTask)
JFacePlugin DEBUG: Created SubMonitor.convert call: SubMonitor.convert(MISSING,"",0)
JFacePlugin DEBUG: Rewriting SubProgressMonitor at position 252 (ClassInstanceCreation)
JFacePlugin DEBUG: Rewriting beginTask at position 369 (method: beginTask)
JFacePlugin DEBUG: Created SubMonitor.convert call: SubMonitor.convert(MISSING,"",0)
JFacePlugin DEBUG: Rewriting SubProgressMonitor at position 432 (ClassInstanceCreation)
JFacePlugin DEBUG: Found beginTask at position 270 (type: MethodInvocation)
JFacePlugin DEBUG: Found SubProgressMonitor construction at position 329 for variable 'm' with beginTask
JFacePlugin: Adding 1 dataholder operations
JFacePlugin DEBUG: Rewriting beginTask at position 270 (method: beginTask)
JFacePlugin DEBUG: Created SubMonitor.convert call: SubMonitor.convert(MISSING,"",0)
JFacePlugin DEBUG: Rewriting SubProgressMonitor at position 329 (ClassInstanceCreation)
JFacePlugin DEBUG: Found beginTask at position 186 (type: MethodInvocation)
JFacePlugin DEBUG: Found SubProgressMonitor construction at position 243 for variable 'monitor' with beginTask
JFacePlugin: Adding 1 dataholder operations
JFacePlugin DEBUG: Rewriting beginTask at position 186 (method: beginTask)
JFacePlugin DEBUG: Created SubMonitor.convert call: SubMonitor.convert(MISSING,"",0)
JFacePlugin DEBUG: Rewriting SubProgressMonitor at position 243 (ClassInstanceCreation)
JFacePlugin DEBUG: Found beginTask at position 186 (type: MethodInvocation)
JFacePlugin DEBUG: Found SubProgressMonitor construction at position 243 for variable 'monitor' with beginTask
JFacePlugin: Adding 1 dataholder operations
JFacePlugin DEBUG: Rewriting beginTask at position 186 (method: beginTask)
JFacePlugin DEBUG: Created SubMonitor.convert call: SubMonitor.convert(MISSING,"",0)
JFacePlugin DEBUG: Rewriting SubProgressMonitor at position 243 (ClassInstanceCreation)
JFacePlugin DEBUG: Found beginTask at position 288 (type: MethodInvocation)
JFacePlugin DEBUG: Found SubProgressMonitor construction at position 421 for variable 'monitor' with beginTask
JFacePlugin: Adding 1 dataholder operations
JFacePlugin DEBUG: Rewriting beginTask at position 288 (method: beginTask)
JFacePlugin DEBUG: Created SubMonitor.convert call: SubMonitor.convert(MISSING,"",0)
JFacePlugin DEBUG: Rewriting SubProgressMonitor at position 421 (ClassInstanceCreation)
Tests run: 25, Failures: 3, Errors: 0, Skipped: 0, Time elapsed: 2.443 s <<< FAILURE! -- in org.sandbox.jdt.ui.tests.quickfix.Java8CleanUpTest
org.sandbox.jdt.ui.tests.quickfix.Java8CleanUpTest.testJFaceCleanupdonttouch(NOJFaceCleanupCases)[1] -- Time elapsed: 0.632 s
org.sandbox.jdt.ui.tests.quickfix.Java8CleanUpTest.testViewerSorterCleanup(ViewerSorterCleanupCases)[1] -- Time elapsed: 0.254 s
org.sandbox.jdt.ui.tests.quickfix.Java8CleanUpTest.testViewerSorterCleanup(ViewerSorterCleanupCases)[2] -- Time elapsed: 0.118 s
org.sandbox.jdt.ui.tests.quickfix.Java8CleanUpTest.testViewerSorterCleanup(ViewerSorterCleanupCases)[3] -- Time elapsed: 0.057 s
org.sandbox.jdt.ui.tests.quickfix.Java8CleanUpTest.testViewerSorterCleanup(ViewerSorterCleanupCases)[4] -- Time elapsed: 0.060 s
org.sandbox.jdt.ui.tests.quickfix.Java8CleanUpTest.testViewerSorterCleanup(ViewerSorterCleanupCases)[5] -- Time elapsed: 0.060 s
org.sandbox.jdt.ui.tests.quickfix.Java8CleanUpTest.testViewerSorterCleanup(ViewerSorterCleanupCases)[6] -- Time elapsed: 0.052 s
org.sandbox.jdt.ui.tests.quickfix.Java8CleanUpTest.testViewerSorterCleanup(ViewerSorterCleanupCases)[7] -- Time elapsed: 0.050 s
org.sandbox.jdt.ui.tests.quickfix.Java8CleanUpTest.testViewerSorterCleanup(ViewerSorterCleanupCases)[8] -- Time elapsed: 0.051 s
org.sandbox.jdt.ui.tests.quickfix.Java8CleanUpTest.testViewerSorterCleanup(ViewerSorterCleanupCases)[9] -- Time elapsed: 0.077 s
org.sandbox.jdt.ui.tests.quickfix.Java8CleanUpTest.testViewerSorterCleanup(ViewerSorterCleanupCases)[10] -- Time elapsed: 0.088 s
org.sandbox.jdt.ui.tests.quickfix.Java8CleanUpTest.testJFaceCleanupParametrized(JFaceCleanupCases)[1] -- Time elapsed: 0.125 s
org.sandbox.jdt.ui.tests.quickfix.Java8CleanUpTest.testJFaceCleanupParametrized(JFaceCleanupCases)[2] -- Time elapsed: 0.141 s
org.sandbox.jdt.ui.tests.quickfix.Java8CleanUpTest.testJFaceCleanupParametrized(JFaceCleanupCases)[3] -- Time elapsed: 0.056 s
org.sandbox.jdt.ui.tests.quickfix.Java8CleanUpTest.testJFaceCleanupParametrized(JFaceCleanupCases)[4] -- Time elapsed: 0.061 s
org.sandbox.jdt.ui.tests.quickfix.Java8CleanUpTest.testJFaceCleanupParametrized(JFaceCleanupCases)[5] -- Time elapsed: 0.036 s
org.sandbox.jdt.ui.tests.quickfix.Java8CleanUpTest.testJFaceCleanupParametrized(JFaceCleanupCases)[6] -- Time elapsed: 0.053 s
org.sandbox.jdt.ui.tests.quickfix.Java8CleanUpTest.testJFaceCleanupParametrized(JFaceCleanupCases)[7] -- Time elapsed: 0.062 s
org.sandbox.jdt.ui.tests.quickfix.Java8CleanUpTest.testJFaceCleanupParametrized(JFaceCleanupCases)[8] -- Time elapsed: 0.056 s
org.sandbox.jdt.ui.tests.quickfix.Java8CleanUpTest.testJFaceCleanupParametrized(JFaceCleanupCases)[9] -- Time elapsed: 0.052 s
org.sandbox.jdt.ui.tests.quickfix.Java8CleanUpTest.testJFaceCleanupParametrized(JFaceCleanupCases)[10] -- Time elapsed: 0.055 s
org.sandbox.jdt.ui.tests.quickfix.Java8CleanUpTest.testJFaceCleanupParametrized(JFaceCleanupCases)[11] -- Time elapsed: 0.047 s
org.sandbox.jdt.ui.tests.quickfix.Java8CleanUpTest.testJFaceCleanupParametrized(JFaceCleanupCases)[12] -- Time elapsed: 0.037 s <<< FAILURE!
org.opentest4j.AssertionFailedError: 
expected: <package test;
import org.eclipse.core.runtime.IProgressMonitor;
import org.eclipse.core.runtime.SubMonitor;
public class Test {
	public void doWork(IProgressMonitor monitor) {
		// No beginTask call, just standalone SubProgressMonitor
		IProgressMonitor sub = SubMonitor.convert(monitor).split(50);
		sub.worked(10);
	}
}
> but was: <package test;
import org.eclipse.core.runtime.IProgressMonitor;
import org.eclipse.core.runtime.SubProgressMonitor;
public class Test {
	public void doWork(IProgressMonitor monitor) {
		// No beginTask call, just standalone SubProgressMonitor
		IProgressMonitor sub = new SubProgressMonitor(monitor, 50);
		sub.worked(10);
	}
}
>
	at org.junit.jupiter.api.AssertionFailureBuilder.build(AssertionFailureBuilder.java:151)
	at org.junit.jupiter.api.AssertionFailureBuilder.buildAndThrow(AssertionFailureBuilder.java:132)
	at org.junit.jupiter.api.AssertEquals.failNotEqual(AssertEquals.java:197)
	at org.junit.jupiter.api.AssertEquals.assertEquals(AssertEquals.java:182)
	at org.junit.jupiter.api.AssertEquals.assertEquals(AssertEquals.java:177)
	at org.junit.jupiter.api.Assertions.assertEquals(Assertions.java:1145)
	at org.sandbox.jdt.ui.tests.quickfix.rules.AbstractEclipseJava.assertEqualStringsIgnoreOrder(AbstractEclipseJava.java:669)
	at org.sandbox.jdt.ui.tests.quickfix.rules.AbstractEclipseJava.assertRefactoringResultAsExpected(AbstractEclipseJava.java:539)
	at org.sandbox.jdt.ui.tests.quickfix.Java8CleanUpTest.testJFaceCleanupParametrized(Java8CleanUpTest.java:469)
	at java.base/java.lang.reflect.Method.invoke(Method.java:580)
	at java.base/java.util.Optional.ifPresent(Optional.java:178)
	at java.base/java.util.stream.ForEachOps$ForEachOp$OfRef.accept(ForEachOps.java:184)
	at java.base/java.util.stream.ReferencePipeline$3$1.accept(ReferencePipeline.java:197)
	at java.base/java.util.stream.ForEachOps$ForEachOp$OfRef.accept(ForEachOps.java:184)
	at java.base/java.util.stream.ForEachOps$ForEachOp$OfRef.accept(ForEachOps.java:184)
	at java.base/java.util.stream.ReferencePipeline$3$1.accept(ReferencePipeline.java:197)
	at java.base/java.util.Iterator.forEachRemaining(Iterator.java:133)
	at java.base/java.util.Spliterators$IteratorSpliterator.forEachRemaining(Spliterators.java:1939)
	at java.base/java.util.stream.AbstractPipeline.copyInto(AbstractPipeline.java:509)
	at java.base/java.util.stream.AbstractPipeline.wrapAndCopyInto(AbstractPipeline.java:499)
	at java.base/java.util.stream.ForEachOps$ForEachOp.evaluateSequential(ForEachOps.java:151)
	at java.base/java.util.stream.ForEachOps$ForEachOp$OfRef.evaluateSequential(ForEachOps.java:174)
	at java.base/java.util.stream.AbstractPipeline.evaluate(AbstractPipeline.java:234)
	at java.base/java.util.stream.ReferencePipeline.forEach(ReferencePipeline.java:596)
	at java.base/java.util.stream.ReferencePipeline$7$1.accept(ReferencePipeline.java:276)
	at java.base/java.util.ArrayList$ArrayListSpliterator.forEachRemaining(ArrayList.java:1708)
	at java.base/java.util.stream.AbstractPipeline.copyInto(AbstractPipeline.java:509)
	at java.base/java.util.stream.AbstractPipeline.wrapAndCopyInto(AbstractPipeline.java:499)
	at java.base/java.util.stream.ForEachOps$ForEachOp.evaluateSequential(ForEachOps.java:151)
	at java.base/java.util.stream.ForEachOps$ForEachOp$OfRef.evaluateSequential(ForEachOps.java:174)
	at java.base/java.util.stream.AbstractPipeline.evaluate(AbstractPipeline.java:234)
	at java.base/java.util.stream.ReferencePipeline.forEach(ReferencePipeline.java:596)
	at java.base/java.util.stream.ReferencePipeline$7$1.accept(ReferencePipeline.java:276)
	at java.base/java.util.stream.ReferencePipeline$3$1.accept(ReferencePipeline.java:197)
	at java.base/java.util.stream.ReferencePipeline$3$1.accept(ReferencePipeline.java:197)
	at java.base/java.util.stream.ReferencePipeline$3$1.accept(ReferencePipeline.java:197)
	at java.base/java.util.ArrayList$ArrayListSpliterator.forEachRemaining(ArrayList.java:1708)
	at java.base/java.util.stream.AbstractPipeline.copyInto(AbstractPipeline.java:509)
	at java.base/java.util.stream.AbstractPipeline.wrapAndCopyInto(AbstractPipeline.java:499)
	at java.base/java.util.stream.ForEachOps$ForEachOp.evaluateSequential(ForEachOps.java:151)
	at java.base/java.util.stream.ForEachOps$ForEachOp$OfRef.evaluateSequential(ForEachOps.java:174)
	at java.base/java.util.stream.AbstractPipeline.evaluate(AbstractPipeline.java:234)
	at java.base/java.util.stream.ReferencePipeline.forEach(ReferencePipeline.java:596)
	at java.base/java.util.ArrayList.forEach(ArrayList.java:1596)
	at java.base/java.util.ArrayList.forEach(ArrayList.java:1596)

org.sandbox.jdt.ui.tests.quickfix.Java8CleanUpTest.testJFaceCleanupParametrized(JFaceCleanupCases)[13] -- Time elapsed: 0.031 s <<< FAILURE!
org.opentest4j.AssertionFailedError: 
expected: <package test;
import org.eclipse.core.runtime.IProgressMonitor;
import org.eclipse.core.runtime.SubMonitor;
public class Test {
	public void doWork(IProgressMonitor monitor) {
		IProgressMonitor sub = SubMonitor.convert(monitor).split(50, SubMonitor.SUPPRESS_SUBTASK);
	}
}
> but was: <package test;
import org.eclipse.core.runtime.IProgressMonitor;
import org.eclipse.core.runtime.SubProgressMonitor;
public class Test {
	public void doWork(IProgressMonitor monitor) {
		IProgressMonitor sub = new SubProgressMonitor(monitor, 50, SubProgressMonitor.SUPPRESS_SUBTASK_LABEL);
	}
}
>
	at org.junit.jupiter.api.AssertionFailureBuilder.build(AssertionFailureBuilder.java:151)
	at org.junit.jupiter.api.AssertionFailureBuilder.buildAndThrow(AssertionFailureBuilder.java:132)
	at org.junit.jupiter.api.AssertEquals.failNotEqual(AssertEquals.java:197)
	at org.junit.jupiter.api.AssertEquals.assertEquals(AssertEquals.java:182)
	at org.junit.jupiter.api.AssertEquals.assertEquals(AssertEquals.java:177)
	at org.junit.jupiter.api.Assertions.assertEquals(Assertions.java:1145)
	at org.sandbox.jdt.ui.tests.quickfix.rules.AbstractEclipseJava.assertEqualStringsIgnoreOrder(AbstractEclipseJava.java:669)
	at org.sandbox.jdt.ui.tests.quickfix.rules.AbstractEclipseJava.assertRefactoringResultAsExpected(AbstractEclipseJava.java:539)
	at org.sandbox.jdt.ui.tests.quickfix.Java8CleanUpTest.testJFaceCleanupParametrized(Java8CleanUpTest.java:469)
	at java.base/java.lang.reflect.Method.invoke(Method.java:580)
	at java.base/java.util.Optional.ifPresent(Optional.java:178)
	at java.base/java.util.stream.ForEachOps$ForEachOp$OfRef.accept(ForEachOps.java:184)
	at java.base/java.util.stream.ReferencePipeline$3$1.accept(ReferencePipeline.java:197)
	at java.base/java.util.stream.ForEachOps$ForEachOp$OfRef.accept(ForEachOps.java:184)
	at java.base/java.util.stream.ForEachOps$ForEachOp$OfRef.accept(ForEachOps.java:184)
	at java.base/java.util.stream.ReferencePipeline$3$1.accept(ReferencePipeline.java:197)
	at java.base/java.util.Iterator.forEachRemaining(Iterator.java:133)
	at java.base/java.util.Spliterators$IteratorSpliterator.forEachRemaining(Spliterators.java:1939)
	at java.base/java.util.stream.AbstractPipeline.copyInto(AbstractPipeline.java:509)
	at java.base/java.util.stream.AbstractPipeline.wrapAndCopyInto(AbstractPipeline.java:499)
	at java.base/java.util.stream.ForEachOps$ForEachOp.evaluateSequential(ForEachOps.java:151)
	at java.base/java.util.stream.ForEachOps$ForEachOp$OfRef.evaluateSequential(ForEachOps.java:174)
	at java.base/java.util.stream.AbstractPipeline.evaluate(AbstractPipeline.java:234)
	at java.base/java.util.stream.ReferencePipeline.forEach(ReferencePipeline.java:596)
	at java.base/java.util.stream.ReferencePipeline$7$1.accept(ReferencePipeline.java:276)
	at java.base/java.util.ArrayList$ArrayListSpliterator.forEachRemaining(ArrayList.java:1708)
	at java.base/java.util.stream.AbstractPipeline.copyInto(AbstractPipeline.java:509)
	at java.base/java.util.stream.AbstractPipeline.wrapAndCopyInto(AbstractPipeline.java:499)
	at java.base/java.util.stream.ForEachOps$ForEachOp.evaluateSequential(ForEachOps.java:151)
	at java.base/java.util.stream.ForEachOps$ForEachOp$OfRef.evaluateSequential(ForEachOps.java:174)
	at java.base/java.util.stream.AbstractPipeline.evaluate(AbstractPipeline.java:234)
	at java.base/java.util.stream.ReferencePipeline.forEach(ReferencePipeline.java:596)
	at java.base/java.util.stream.ReferencePipeline$7$1.accept(ReferencePipeline.java:276)
	at java.base/java.util.stream.ReferencePipeline$3$1.accept(ReferencePipeline.java:197)
	at java.base/java.util.stream.ReferencePipeline$3$1.accept(ReferencePipeline.java:197)
	at java.base/java.util.stream.ReferencePipeline$3$1.accept(ReferencePipeline.java:197)
	at java.base/java.util.ArrayList$ArrayListSpliterator.forEachRemaining(ArrayList.java:1708)
	at java.base/java.util.stream.AbstractPipeline.copyInto(AbstractPipeline.java:509)
	at java.base/java.util.stream.AbstractPipeline.wrapAndCopyInto(AbstractPipeline.java:499)
	at java.base/java.util.stream.ForEachOps$ForEachOp.evaluateSequential(ForEachOps.java:151)
	at java.base/java.util.stream.ForEachOps$ForEachOp$OfRef.evaluateSequential(ForEachOps.java:174)
	at java.base/java.util.stream.AbstractPipeline.evaluate(AbstractPipeline.java:234)
	at java.base/java.util.stream.ReferencePipeline.forEach(ReferencePipeline.java:596)
	at java.base/java.util.ArrayList.forEach(ArrayList.java:1596)
	at java.base/java.util.ArrayList.forEach(ArrayList.java:1596)

org.sandbox.jdt.ui.tests.quickfix.Java8CleanUpTest.testJFaceCleanupParametrized(JFaceCleanupCases)[14] -- Time elapsed: 0.035 s <<< FAILURE!
org.opentest4j.AssertionFailedError: 
expected: <package test;
import org.eclipse.core.runtime.IProgressMonitor;
import org.eclipse.core.runtime.SubMonitor;
public class Test {
	public void doWork(IProgressMonitor monitor) {
		SubMonitor subMonitor = SubMonitor.convert(monitor, "Task", 100);
		// This should use split() directly, not convert().split()
		IProgressMonitor sub = subMonitor.split(50);
	}
}
> but was: <package test;
import org.eclipse.core.runtime.IProgressMonitor;
import org.eclipse.core.runtime.SubProgressMonitor;
import org.eclipse.core.runtime.SubMonitor;
public class Test {
	public void doWork(IProgressMonitor monitor) {
		SubMonitor subMonitor = SubMonitor.convert(monitor, "Task", 100);
		// This should use split() directly, not convert().split()
		IProgressMonitor sub = new SubProgressMonitor(subMonitor, 50);
	}
}
>
	at org.junit.jupiter.api.AssertionFailureBuilder.build(AssertionFailureBuilder.java:151)
	at org.junit.jupiter.api.AssertionFailureBuilder.buildAndThrow(AssertionFailureBuilder.java:132)
	at org.junit.jupiter.api.AssertEquals.failNotEqual(AssertEquals.java:197)
	at org.junit.jupiter.api.AssertEquals.assertEquals(AssertEquals.java:182)
	at org.junit.jupiter.api.AssertEquals.assertEquals(AssertEquals.java:177)
	at org.junit.jupiter.api.Assertions.assertEquals(Assertions.java:1145)
	at org.sandbox.jdt.ui.tests.quickfix.rules.AbstractEclipseJava.assertEqualStringsIgnoreOrder(AbstractEclipseJava.java:669)
	at org.sandbox.jdt.ui.tests.quickfix.rules.AbstractEclipseJava.assertRefactoringResultAsExpected(AbstractEclipseJava.java:539)
	at org.sandbox.jdt.ui.tests.quickfix.Java8CleanUpTest.testJFaceCleanupParametrized(Java8CleanUpTest.java:469)
	at java.base/java.lang.reflect.Method.invoke(Method.java:580)
	at java.base/java.util.Optional.ifPresent(Optional.java:178)
	at java.base/java.util.stream.ForEachOps$ForEachOp$OfRef.accept(ForEachOps.java:184)
	at java.base/java.util.stream.ReferencePipeline$3$1.accept(ReferencePipeline.java:197)
	at java.base/java.util.stream.ForEachOps$ForEachOp$OfRef.accept(ForEachOps.java:184)
	at java.base/java.util.stream.ForEachOps$ForEachOp$OfRef.accept(ForEachOps.java:184)
	at java.base/java.util.stream.ReferencePipeline$3$1.accept(ReferencePipeline.java:197)
	at java.base/java.util.Iterator.forEachRemaining(Iterator.java:133)
	at java.base/java.util.Spliterators$IteratorSpliterator.forEachRemaining(Spliterators.java:1939)
	at java.base/java.util.stream.AbstractPipeline.copyInto(AbstractPipeline.java:509)
	at java.base/java.util.stream.AbstractPipeline.wrapAndCopyInto(AbstractPipeline.java:499)
	at java.base/java.util.stream.ForEachOps$ForEachOp.evaluateSequential(ForEachOps.java:151)
	at java.base/java.util.stream.ForEachOps$ForEachOp$OfRef.evaluateSequential(ForEachOps.java:174)
	at java.base/java.util.stream.AbstractPipeline.evaluate(AbstractPipeline.java:234)
	at java.base/java.util.stream.ReferencePipeline.forEach(ReferencePipeline.java:596)
	at java.base/java.util.stream.ReferencePipeline$7$1.accept(ReferencePipeline.java:276)
	at java.base/java.util.ArrayList$ArrayListSpliterator.forEachRemaining(ArrayList.java:1708)
	at java.base/java.util.stream.AbstractPipeline.copyInto(AbstractPipeline.java:509)
	at java.base/java.util.stream.AbstractPipeline.wrapAndCopyInto(AbstractPipeline.java:499)
	at java.base/java.util.stream.ForEachOps$ForEachOp.evaluateSequential(ForEachOps.java:151)
	at java.base/java.util.stream.ForEachOps$ForEachOp$OfRef.evaluateSequential(ForEachOps.java:174)
	at java.base/java.util.stream.AbstractPipeline.evaluate(AbstractPipeline.java:234)
	at java.base/java.util.stream.ReferencePipeline.forEach(ReferencePipeline.java:596)
	at java.base/java.util.stream.ReferencePipeline$7$1.accept(ReferencePipeline.java:276)
	at java.base/java.util.stream.ReferencePipeline$3$1.accept(ReferencePipeline.java:197)
	at java.base/java.util.stream.ReferencePipeline$3$1.accept(ReferencePipeline.java:197)
	at java.base/java.util.stream.ReferencePipeline$3$1.accept(ReferencePipeline.java:197)
	at java.base/java.util.ArrayList$ArrayListSpliterator.forEachRemaining(ArrayList.java:1708)
	at java.base/java.util.stream.AbstractPipeline.copyInto(AbstractPipeline.java:509)
	at java.base/java.util.stream.AbstractPipeline.wrapAndCopyInto(AbstractPipeline.java:499)
	at java.base/java.util.stream.ForEachOps$ForEachOp.evaluateSequential(ForEachOps.java:151)
	at java.base/java.util.stream.ForEachOps$ForEachOp$OfRef.evaluateSequential(ForEachOps.java:174)
	at java.base/java.util.stream.AbstractPipeline.evaluate(AbstractPipeline.java:234)
	at java.base/java.util.stream.ReferencePipeline.forEach(ReferencePipeline.java:596)
	at java.base/java.util.ArrayList.forEach(ArrayList.java:1596)
	at java.base/java.util.ArrayList.forEach(ArrayList.java:1596)


Results:

Failures: 
  Java8CleanUpTest.testJFaceCleanupParametrized:469 expected: <package test;
import org.eclipse.core.runtime.IProgressMonitor;
import org.eclipse.core.runtime.SubMonitor;
public class Test {
	public void doWork(IProgressMonitor monitor) {
		// No beginTask call, just standalone SubProgressMonitor
		IProgressMonitor sub = SubMonitor.convert(monitor).split(50);
		sub.worked(10);
	}
}
> but was: <package test;
import org.eclipse.core.runtime.IProgressMonitor;
import org.eclipse.core.runtime.SubProgressMonitor;
public class Test {
	public void doWork(IProgressMonitor monitor) {
		// No beginTask call, just standalone SubProgressMonitor
		IProgressMonitor sub = new SubProgressMonitor(monitor, 50);
		sub.worked(10);
	}
}
>
  Java8CleanUpTest.testJFaceCleanupParametrized:469 expected: <package test;
import org.eclipse.core.runtime.IProgressMonitor;
import org.eclipse.core.runtime.SubMonitor;
public class Test {
	public void doWork(IProgressMonitor monitor) {
		IProgressMonitor sub = SubMonitor.convert(monitor).split(50, SubMonitor.SUPPRESS_SUBTASK);
	}
}
> but was: <package test;
import org.eclipse.core.runtime.IProgressMonitor;
import org.eclipse.core.runtime.SubProgressMonitor;
public class Test {
	public void doWork(IProgressMonitor monitor) {
		IProgressMonitor sub = new SubProgressMonitor(monitor, 50, SubProgressMonitor.SUPPRESS_SUBTASK_LABEL);
	}
}
>
  Java8CleanUpTest.testJFaceCleanupParametrized:469 expected: <package test;
import org.eclipse.core.runtime.IProgressMonitor;
import org.eclipse.core.runtime.SubMonitor;
public class Test {
	public void doWork(IProgressMonitor monitor) {
		SubMonitor subMonitor = SubMonitor.convert(monitor, "Task", 100);
		// This should use split() directly, not convert().split()
		IProgressMonitor sub = subMonitor.split(50);
	}
}
> but was: <package test;
import org.eclipse.core.runtime.IProgressMonitor;
import org.eclipse.core.runtime.SubProgressMonitor;
import org.eclipse.core.runtime.SubMonitor;
public class Test {
	public void doWork(IProgressMonitor monitor) {
		SubMonitor subMonitor = SubMonitor.convert(monitor, "Task", 100);
		// This should use split() directly, not convert().split()
		IProgressMonitor sub = new SubProgressMonitor(subMonitor, 50);
	}
}
>

Tests run: 25, Failures: 3, Errors: 0, Skipped: 0

[INFO] ------------------------------------------------------------------------
[INFO] BUILD FAILURE
[INFO] ------------------------------------------------------------------------
[INFO] Total time:  39.938 s
[INFO] Finished at: 2026-02-12T03:43:05Z
[INFO] ------------------------------------------------------------------------
[ERROR] Failed to execute goal org.eclipse.tycho:tycho-surefire-plugin:5.0.2:test (default-test) on project sandbox_jface_cleanup_test: There are test failures.
[ERROR] 
[ERROR] Please refer to /home/runner/work/sandbox/sandbox/sandbox_jface_cleanup_test/target/surefire-reports for the individual test results.
[ERROR] 
[ERROR] 
[ERROR] -> [Help 1]
[ERROR] 
[ERROR] To see the full stack trace of the errors, re-run Maven with the -e switch.
[ERROR] Re-run Maven using the -X switch to enable full debug logging.
[ERROR] 
[ERROR] For more information about the errors and possible solutions, please read the following articles:
[ERROR] [Help 1] http://cwiki.apache.org/confluence/display/MAVEN/MojoFailureException
